{
  "$schema": "designtoken-ir/v1",
  "colors": {
    "color.accent.sky": {
      "group": "accent",
      "id": "color.accent.sky",
      "kind": "color",
      "provenance": {
        "figmaKey": "Accent/Sky",
        "instances": 1,
        "manual": true,
        "source": "figma:Gia Định Group COPY"
      },
      "scale": "sky",
      "value": "#a2d7e9"
    },
    "color.grey.d9": {
      "group": "grey",
      "id": "color.grey.d9",
      "kind": "color",
      "provenance": {
        "figmaKey": "Grey/d9",
        "instances": 1,
        "manual": true,
        "source": "figma:Gia Định Group COPY"
      },
      "scale": "d9",
      "value": "#d9d9d9"
    },
    "color.neutral.white": {
      "group": "neutral",
      "id": "color.neutral.white",
      "kind": "color",
      "provenance": {
        "figmaKey": "Neutral/White#40003:840",
        "figmaStyleId": "40003:840",
        "instances": 7,
        "source": "figma:Gia Định Group COPY"
      },
      "scale": "white",
      "value": "#ffffff"
    },
    "color.primary.1": {
      "diagnostics": [
        {
          "code": "NAME_COLLISION",
          "competingIds": [
            "#254b9d×174",
            "#991f21×32",
            "#4d3300×2",
            "#101010×1"
          ],
          "detail": "identity 'Primary/1' exports 4 distinct hex values; kept most frequent #254b9d",
          "severity": "warn",
          "subject": "color.primary.1"
        }
      ],
      "group": "primary",
      "id": "color.primary.1",
      "kind": "color",
      "provenance": {
        "figmaKey": "Primary/1#12006:1619",
        "figmaStyleId": "12006:1619",
        "instances": 6,
        "source": "figma:Gia Định Group COPY"
      },
      "scale": "1",
      "value": "#254b9d"
    },
    "color.primary.2": {
      "group": "primary",
      "id": "color.primary.2",
      "kind": "color",
      "provenance": {
        "figmaKey": "Primary/2#12006:1621",
        "figmaStyleId": "12006:1621",
        "instances": 6,
        "source": "figma:Gia Định Group COPY"
      },
      "scale": "2",
      "value": "#eb2228"
    },
    "color.primary.3": {
      "group": "primary",
      "id": "color.primary.3",
      "kind": "color",
      "provenance": {
        "figmaKey": "Primary/3#12006:1613",
        "figmaStyleId": "12006:1613",
        "instances": 4,
        "source": "figma:Gia Định Group COPY"
      },
      "scale": "3",
      "value": "#808285"
    },
    "color.primary.4": {
      "group": "primary",
      "id": "color.primary.4",
      "kind": "color",
      "provenance": {
        "figmaKey": "Primary/4#12006:1622",
        "figmaStyleId": "12006:1622",
        "instances": 2,
        "source": "figma:Gia Định Group COPY"
      },
      "scale": "4",
      "value": "#ffffff"
    },
    "color.primary.bg": {
      "group": "primary",
      "id": "color.primary.bg",
      "kind": "color",
      "provenance": {
        "figmaKey": "Primary/bg",
        "instances": 1,
        "source": "figma:Gia Định Group COPY"
      },
      "scale": "bg",
      "value": "#f2ede4"
    },
    "color.primary.table-accent-a": {
      "group": "primary",
      "id": "color.primary.table-accent-a",
      "kind": "color",
      "provenance": {
        "figmaKey": "Primary/Table Accent A",
        "instances": 1,
        "manual": true,
        "source": "figma:Gia Định Group COPY"
      },
      "scale": "table-accent-a",
      "value": "#b9d5e6"
    },
    "color.primary.table-accent-b": {
      "group": "primary",
      "id": "color.primary.table-accent-b",
      "kind": "color",
      "provenance": {
        "figmaKey": "Primary/Table Accent B",
        "instances": 1,
        "manual": true,
        "source": "figma:Gia Định Group COPY"
      },
      "scale": "table-accent-b",
      "value": "#a7c9de"
    },
    "color.primary.table-surface": {
      "group": "primary",
      "id": "color.primary.table-surface",
      "kind": "color",
      "provenance": {
        "figmaKey": "Primary/Table Surface",
        "instances": 1,
        "manual": true,
        "source": "figma:Gia Định Group COPY"
      },
      "scale": "table-surface",
      "value": "#d3e4f0"
    },
    "color.secondary.2": {
      "group": "secondary",
      "id": "color.secondary.2",
      "kind": "color",
      "provenance": {
        "figmaKey": "Secondary/2",
        "instances": 1,
        "source": "figma:Gia Định Group COPY"
      },
      "scale": "2",
      "value": "#a4adb8"
    },
    "color.secondary.3": {
      "group": "secondary",
      "id": "color.secondary.3",
      "kind": "color",
      "provenance": {
        "figmaKey": "Secondary/3#40002:2277",
        "figmaStyleId": "40002:2277",
        "instances": 2,
        "source": "figma:Gia Định Group COPY"
      },
      "scale": "3",
      "value": "#545554"
    },
    "color.secondary.bg": {
      "group": "secondary",
      "id": "color.secondary.bg",
      "kind": "color",
      "provenance": {
        "figmaKey": "Secondary/BG",
        "instances": 1,
        "source": "figma:Gia Định Group COPY"
      },
      "scale": "bg",
      "value": "#cee3ff"
    },
    "color.secondary.utility-black-20": {
      "group": "secondary",
      "id": "color.secondary.utility-black-20",
      "kind": "color",
      "provenance": {
        "figmaKey": "Secondary/Utility-Black-20",
        "instances": 1,
        "source": "figma:Gia Định Group COPY"
      },
      "scale": "utility-black-20",
      "value": "#000000"
    },
    "color.secondary.utility-white-50": {
      "group": "secondary",
      "id": "color.secondary.utility-white-50",
      "kind": "color",
      "provenance": {
        "figmaKey": "Secondary/Utility - White-50",
        "instances": 1,
        "source": "figma:Gia Định Group COPY"
      },
      "scale": "utility-white-50",
      "value": "#ffffff"
    },
    "color.secondary.white-80": {
      "group": "secondary",
      "id": "color.secondary.white-80",
      "kind": "color",
      "provenance": {
        "figmaKey": "Secondary/White-80",
        "instances": 1,
        "source": "figma:Gia Định Group COPY"
      },
      "scale": "white-80",
      "value": "#ffffff"
    },
    "color.utility.black": {
      "group": "utility",
      "id": "color.utility.black",
      "kind": "color",
      "provenance": {
        "figmaKey": "Utility/black#12006:1639",
        "figmaStyleId": "12006:1639",
        "instances": 2,
        "source": "figma:Gia Định Group COPY"
      },
      "scale": "black",
      "value": "#000000"
    },
    "color.utility.gray-100": {
      "group": "utility",
      "id": "color.utility.gray-100",
      "kind": "color",
      "provenance": {
        "figmaKey": "Utility/gray-100#12006:1633",
        "figmaStyleId": "12006:1633",
        "instances": 5,
        "source": "figma:Gia Định Group COPY"
      },
      "scale": "gray-100",
      "value": "#efefef"
    },
    "color.utility.gray-200": {
      "group": "utility",
      "id": "color.utility.gray-200",
      "kind": "color",
      "provenance": {
        "figmaKey": "Utility/gray-200#12006:1634",
        "figmaStyleId": "12006:1634",
        "instances": 4,
        "source": "figma:Gia Định Group COPY"
      },
      "scale": "gray-200",
      "value": "#dcdcdc"
    },
    "color.utility.gray-300": {
      "group": "utility",
      "id": "color.utility.gray-300",
      "kind": "color",
      "provenance": {
        "figmaKey": "Utility/gray-300#12006:1635",
        "figmaStyleId": "12006:1635",
        "instances": 5,
        "source": "figma:Gia Định Group COPY"
      },
      "scale": "gray-300",
      "value": "#bdbdbd"
    },
    "color.utility.gray-50": {
      "group": "utility",
      "id": "color.utility.gray-50",
      "kind": "color",
      "provenance": {
        "figmaKey": "Utility/gray-50#12006:1632",
        "figmaStyleId": "12006:1632",
        "instances": 6,
        "source": "figma:Gia Định Group COPY"
      },
      "scale": "gray-50",
      "value": "#f6f6f6"
    },
    "color.utility.gray-500": {
      "group": "utility",
      "id": "color.utility.gray-500",
      "kind": "color",
      "provenance": {
        "figmaKey": "Utility/gray-500#12006:1637",
        "figmaStyleId": "12006:1637",
        "instances": 5,
        "source": "figma:Gia Định Group COPY"
      },
      "scale": "gray-500",
      "value": "#818181"
    },
    "color.utility.gray-800": {
      "group": "utility",
      "id": "color.utility.gray-800",
      "kind": "color",
      "provenance": {
        "figmaKey": "Utility/gray-800",
        "instances": 1,
        "source": "figma:Gia Định Group COPY"
      },
      "scale": "gray-800",
      "value": "#464646"
    },
    "color.utility.gray-950": {
      "group": "utility",
      "id": "color.utility.gray-950",
      "kind": "color",
      "provenance": {
        "figmaKey": "Utility/gray-950#12006:1642",
        "figmaStyleId": "12006:1642",
        "instances": 7,
        "source": "figma:Gia Định Group COPY"
      },
      "scale": "gray-950",
      "value": "#292929"
    },
    "color.utility.white": {
      "group": "utility",
      "id": "color.utility.white",
      "kind": "color",
      "provenance": {
        "figmaKey": "Utility/white#12006:1631",
        "figmaStyleId": "12006:1631",
        "instances": 19,
        "source": "figma:Gia Định Group COPY"
      },
      "scale": "white",
      "value": "#ffffff"
    }
  },
  "components": {},
  "contract": {
    "entries": {
      "Body/Body-1": {
        "cssClass": "body-1",
        "html": "div",
        "locked": true,
        "owner": "human",
        "typography": {
          "$ref": "type.body.body-1",
          "kind": "typography",
          "resolved": false
        }
      },
      "Body/Body-2": {
        "cssClass": "body-2",
        "html": "div",
        "locked": true,
        "owner": "human",
        "typography": {
          "$ref": "type.body.body-2",
          "kind": "typography",
          "resolved": false
        }